{
  "updated_at": "2026-03-02T00:00:00Z",
  "deadlines": [],
  "events": [],
  "priorities": [
    "Ship one growth experiment",
    "Post one high-quality Mustang Market promo",
    "Clear top school deadline"
  ],
  "experiments": [],
  "outreach_queue": [],
  "kpis": {
    "downloads_7d": 0,
    "new_listings_7d": 0,
    "activation_rate": 0,
    "weekly_outreach_touches": 0
  }
}
